Name,Description,Rating,Reviews,Launched Date,Categories,Support Email
S:Request a Quote & Hide Price ," Request a Quote & Hide Price: Easily interact with customers regarding best prices for products  Request a Quote & Hide Price app allows customers to request a quote (call for price/make an offer) for one, some products or the whole shopping cart easily. Customers will add their preferred items to the quote with their wished prices. After viewing the quote requests, store owners can approve, cancel, discuss with customers and modify the quotes, all updates will be notified by email.
Feel free to try our app to understand why merchants around the world trust us.   Request a Quote & Hide Price app allows customers to request a quote (call for price/make an offer) for one, some products or the whole shopping cart easily. Customers will add their preferred items to the quote with their wished prices. After viewing the quote requests, store owners can approve, cancel, discuss with customers and modify the quotes, all updates will be notified by email.
Feel free to try our app to understand why merchants around the world trust us.  more         Easily add the quote button/form to any product and collection page         Convert quotes to draft orders automatically or with just 1 click         Auto-approve quote based on pre-set discount (%)         Show by product, collection, type, vendor, tag, out of stock, language, country         Multi-form [ADVANCED PLAN]: only available with Quick Quote feature    ",Rating (5),88,"November 22, 2021","Custom pricing and quotes, Managing orders - Other, Custom pricing and quotes, Managing orders - Other",storeifyapps@gmail.com
A2Reviews ‑ Product Reviews ," Drive sales with positive reviews from loving photos and videos. Easy to import reviews.  With A2Reviews you can easily manage reviews on your website. The products that are selling on your store will get an increase in purchase rate and increase the rate of customers returning to buy the product. Because provide a smart solution for importing and exporting product reviews. Easily collect reviews from customers who have purchased a product.   With A2Reviews you can easily manage reviews on your website. The products that are selling on your store will get an increase in purchase rate and increase the rate of customers returning to buy the product. Because provide a smart solution for importing and exporting product reviews. Easily collect reviews from customers who have purchased a product.  more         The review importer from Amazon and AliExpress is easy and fast to use.         The review editor is intuitive, easy to use, and supports many tools.         The display of languages is diverse, supporting most languages in the world.    ",Rating (4.9),68,"June 18, 2020","Product reviews, Product reviews",support@a2rev.com
Request a Quote Hide Price B2B ," Offer a request for quote button on selected products
Automatically receive quote mail notifications  Why choose Easy Quote? 
All basic functions you need without charges！
Straightforward operation interface helps you get started within no time. Focus on expanding customer source more efficient instead of adding more dazzling functions. 
An easy 2 steps set-up 1. Add products that you want to show \""Request a Quote\"" button. 2. Enable APP #Hide Prices, Add to Cart Button and Buy Now Button The feature to hide price and “add to cart” button is effective for your B2B clients who have different...   Why choose Easy Quote? 
All basic functions you need without charges！
Straightforward operation interface helps you get started within no time. Focus on expanding customer source more efficient instead of adding more dazzling functions. 
An easy 2 steps set-up 1. Add products that you want to show \""Request a Quote\"" button. 2. Enable APP #Hide Prices, Add to Cart Button and Buy Now Button The feature to hide price and “add to cart” button is effective for your B2B clients who have different...  more         Request for quote button on selected products         Hide Prices, Add to Cart Button and Buy Now Button         Automatically send email to you when new quote is made    ",Rating (4.9),49,"March 2, 2022","Custom pricing and quotes, Custom pricing and quotes",quote@sealapps.com
Drop A Hint 2.0 ," Engage your online \""window shoppers\""
Personalized hints will help you sell and increase revenue  With Drop A Hint 2.0, you can quickly and easily create customizable hint cards. Upload your logo, fonts, brand colors, etc., or use our elegant default design. Style the button to match your site and publish the app to your store. With Drop A Hint 2.0, your visitors will become your best brand ambassadors by sending hints to their loved ones. Sending hints via email, SMS, and postal mail,  will increase your revenue and help your business. Track app performance with our live Dashboard Analytics   With Drop A Hint 2.0, you can quickly and easily create customizable hint cards. Upload your logo, fonts, brand colors, etc., or use our elegant default design. Style the button to match your site and publish the app to your store. With Drop A Hint 2.0, your visitors will become your best brand ambassadors by sending hints to their loved ones. Sending hints via email, SMS, and postal mail,  will increase your revenue and help your business. Track app performance with our live Dashboard Analytics  more         Easy to use click and drag hint editor. Upload custom fonts, colors, logo, etc.         Send hint with SMS. Integration with Klaviyo, Omnisend, Privy, Shopify Email         Realtime analytics with webhooks for inbox performance tracking. Custom reports.         Independent fully customizable mobile hint editor. Auto follow up and coupons         Fully customizable hint cards and button. Custom .CSS and HTML option    ",Rating (4.6),71,"October 5, 2021","Gift registry, Gift registry",support@appsolute.us
Proviews ‑ Product Reviews Q&A ," Auto collect verified reviews, engage more shoppers and boost conversions for your store.  Proviews is your one-stop solution for your product review management requirements. Automate review collection process. Use app\'s widgets to showcase reviews on your online store. Enhance your store’s authenticity & increase brand engagement with product reviews and Q&A. Improve your organic ranking with UGC and the rich snippets that we generate. While advertising, submit product review feed and earn more trust amidst online shoppers. Showcase Site Reviews(NPS Score) for your store.   Proviews is your one-stop solution for your product review management requirements. Automate review collection process. Use app\'s widgets to showcase reviews on your online store. Enhance your store’s authenticity & increase brand engagement with product reviews and Q&A. Improve your organic ranking with UGC and the rich snippets that we generate. While advertising, submit product review feed and earn more trust amidst online shoppers. Showcase Site Reviews(NPS Score) for your store.  more         Collect Photos & Videos reviews on Autopilot along with Q&A for online store         Generate Product Ratings feed for Google and Bing Ads (Microsoft) to improve CTR         Experience completely unbranded services with our Domain White Labelling feature         Collect Site Reviews(NPS Score) to reflect customer\'s experiences for your store         Seamless migration with options to import previously collected reviews    ",Rating (5),50,"June 11, 2021","SEO, Product reviews, SEO, Product reviews",+919723663337
Booster: EU Cookie Bar GDPR ," Create a beautiful GDPR cookie consent bar before you\'ve finished your first coffee  Display a cookie consent or GDPR banner to your store visitors. You can choose to show the cookie bar for every country in the world or only EU countries. The app is user friendly and easy to customize so you can match the design of your shop. Use directly within the Shopify admin for a seamless workflow. You can display a beautiful  banner or bar to accept cookies. To decline cookies, you must provide your own instructions in your privacy policy to ensure you are in compliance with the GDPR.   Display a cookie consent or GDPR banner to your store visitors. You can choose to show the cookie bar for every country in the world or only EU countries. The app is user friendly and easy to customize so you can match the design of your shop. Use directly within the Shopify admin for a seamless workflow. You can display a beautiful  banner or bar to accept cookies. To decline cookies, you must provide your own instructions in your privacy policy to ensure you are in compliance with the GDPR.  more         Show a cookie bar or GDPR consent banner and link to your privacy policy         Customize the banner settings and text using our simple code-free style editor         Customize the cookie bar design and colors to match your theme and brand         Show your cookie consent GDPR banner globally or for EU customers only         24/7 live chat human support for when you have questions or need a hand    ",Rating (4.6),"2,994","December 9, 2016","Banners, Legal, Banners, Legal",support+cookie@boosterapps.com
Price A/B Test ‑ ABConvert ," Maximize your profits with our price A/B testing tools.  ABConvert allows you to run A/B tests for the pricing of any of your products without effort. You can create up to 5 testing groups with varying prices to determine the optimal price for each product. Our comprehensive analytics provide clear insights into the impact of pricing changes for each test, enabling you to identify the best pricing strategy. With our price A/B testing and 24/7 support, boosting your store\'s profits has never been easier.   ABConvert allows you to run A/B tests for the pricing of any of your products without effort. You can create up to 5 testing groups with varying prices to determine the optimal price for each product. Our comprehensive analytics provide clear insights into the impact of pricing changes for each test, enabling you to identify the best pricing strategy. With our price A/B testing and 24/7 support, boosting your store\'s profits has never been easier.  more         Run unlimited A/B tests for any number of products         No need to change product page URL in Shopify for your Google/Facebooks ad         Customize traffic distribution across multiple test prices. (50/50, 10/20/70)         Track AOV, Conversion, and Margin impacts in real-time dashboard         Easy-to-use workflow, no need of copy-pasting code. Set up quickly    ",Rating (5),18,"October 31, 2022","Competitive pricing, Pricing - Other, Competitive pricing, Pricing - Other",support@abconvert.io
G:Request a Quote + Hide Price ," Allows your customers to submit quotes for any product and bargain for the best price  With Globo Request for Quote, buyers can add products to quote in one click from collection and product pages as well as from the shopping cart. Let customers suggest new best-suited prices and add remarks to each quote item.

With this app you can also hide price, hide add-to-cart button of a product. Require customer login to see product prices   With Globo Request for Quote, buyers can add products to quote in one click from collection and product pages as well as from the shopping cart. Let customers suggest new best-suited prices and add remarks to each quote item.

With this app you can also hide price, hide add-to-cart button of a product. Require customer login to see product prices  more         Convert a quote to an order. Convert RFQ to PDF. REST API access         Display RFQ button on any page. Automatic send new quote email.         Customize your RFQ form with Form Builder: upload file, text, email, phone, etc.         Login to see price. Hide product prices based on tag, vendor, collection, etc.    ",Rating (4.9),295,"June 8, 2017","Custom pricing and quotes, Custom pricing and quotes",apps@globosoftware.net
Product Reviews + UGC with Q/A ," Build trust and increase purchases by showing positive experiences with product and photo reviews.  Use our straightforward Product Reviews app to gather social proof for your products. Our app lets merchants easily import reviews and ratings into their store, ask current customers for photo reviews in exchange for discounts, and show positive customer reviews to increase orders and build social proof with automated review emails. Every part can be changed, including the reviews\' layout, the way the carousel widget is set up, and the design and color of the rating symbols.   Use our straightforward Product Reviews app to gather social proof for your products. Our app lets merchants easily import reviews and ratings into their store, ask current customers for photo reviews in exchange for discounts, and show positive customer reviews to increase orders and build social proof with automated review emails. Every part can be changed, including the reviews\' layout, the way the carousel widget is set up, and the design and color of the rating symbols.  more         Choose one of six built-in review layouts and enhance the customer experience.         A built-in Google Shopping feed will store all your reviews under one roof.         The average rating widget will ensure you get quick feedback.         By introducing the product Q/A, you will reduce the possibility of returns.         Incentivize your customers with a promo code in exchange for a review.    ",Rating (4.6),295,"April 5, 2018
          ·","Product reviews, Social proof, Product reviews, Social proof",(773) 831-9374
Appstle℠ Subscriptions ," Conveniently setup and manage subscriptions with robust merchant tools, and an intuitive UI  Discover the most powerful recurring order features in ecommerce, encompassing comprehensive and efficient subscription management tools, loyalty benefits, churn control, box subscriptions, and more.

We work with some of the largest e-commerce brands in the world (Universal Audio, Pela Earth, Inspired Go, Skin Authority) to bring exceptional subscription experiences to their stores in a few clicks.

Have a question or need customization? Our best in class merchant success team is minutes away!   Discover the most powerful recurring order features in ecommerce, encompassing comprehensive and efficient subscription management tools, loyalty benefits, churn control, box subscriptions, and more.

We work with some of the largest e-commerce brands in the world (Universal Audio, Pela Earth, Inspired Go, Skin Authority) to bring exceptional subscription experiences to their stores in a few clicks.

Have a question or need customization? Our best in class merchant success team is minutes away!  more         Sell regular and prepaid subscriptions, with free trial, build a box, and more         Offer tiered discounts, custom shipping, gifts, and more with loyalty features         Present feature rich customer portal with one click login and quick action links         Drive conversion with \'Appstle Menu\': a shopper experience focused menu template         Maximize ROI with upsells, bundling, bulk automation, retention tools, and more    ",Rating (4.9),"1,915","April 8, 2021","Subscriptions, Subscriptions",support@appstle.com
Reviews Importify | Q & A ," Easy and Simple way to Import Reviews from Amazon, Walmart, Esy, Jet, Aliexpress to your Store.  Easily Import Reviews from Marketplaces like Amazon, Ebay, Walmart, Easy, Jet, Aliexpress etc. to your store in just a few clicks. It allows to import reviews with images and videos. Reviews considered the most impotent factor for each shopping site that can help increase product sales. It supports reviews schema markup which allows you to show reviews in google search results. App provide automatic reviews sync option to instantly sync new reviews from marketplace after initial sync.   Easily Import Reviews from Marketplaces like Amazon, Ebay, Walmart, Easy, Jet, Aliexpress etc. to your store in just a few clicks. It allows to import reviews with images and videos. Reviews considered the most impotent factor for each shopping site that can help increase product sales. It supports reviews schema markup which allows you to show reviews in google search results. App provide automatic reviews sync option to instantly sync new reviews from marketplace after initial sync.  more         Easy way to Import Reviews from Amazon, Ebay, Walmart, Etsy, Jet & Aliexpress.         Multiple Reviews Display Section Template and Style Customization Options.         Supports Product Q & A, where customer can ask questions and admin can answer.         Provides Google Reviews XML Feed that can be used to submit Reviews to Google.         Provide option to create a carousel of selected reviews and place it anywhere .    ",Rating (4.7),125,"April 10, 2018","Product reviews, Product reviews",reviewsimportifyhelper@gmail.com
Product AB + Price A/B Testing ," The most trusted A/B testing platform for stores to maximize website conversion rates & sales.  With Trident A/B, you can run a/b tests on your product page, pricing, price testing, copywriting, images, product page layouts in order to find out what converts best. Unlike other third-party a/b testing apps, Trident A/B is fully integrated with Shopify and leverages Shopify\'s existing code-base and infrastructure to run its tests to ensure that you won\'t experience any slowdowns on your site\'s speed. Similar to Google Optimize, Optimizely, VWO and Omniconvert.   With Trident A/B, you can run a/b tests on your product page, pricing, price testing, copywriting, images, product page layouts in order to find out what converts best. Unlike other third-party a/b testing apps, Trident A/B is fully integrated with Shopify and leverages Shopify\'s existing code-base and infrastructure to run its tests to ensure that you won\'t experience any slowdowns on your site\'s speed. Similar to Google Optimize, Optimizely, VWO and Omniconvert.  more         Maximize Store Sales, Conversion Rates, and Profitability by A/B Testing         Site Speed is Important. Zero Impact on Website Load Time, Guaranteed         Intuitive Reporting & Powerful Analytics to Understand How to Improve your Site         Create Tests Without Coding and Without a Statistics Degree. Set up in Minutes.         Don\'t Leave Money on the Table - Traffic is Expensive to Acquire. Get Trident AB    ",Rating (5),21,"August 9, 2021","SEO, Store data - Other, SEO, Store data - Other",info@tridentab.com
Releasit Cash On Delivery ," Add a fee and hide/show Cash on Delivery (COD) based on any condition. Increase prepaid orders!  Releasit Cash On Delivery allows you to fully customize the Cash on Delivery payment method on your store. Add a custom fee (fixed value or percentage) to all your COD orders so that you can cover your additional costs and incentivize prepaid orders. Hide or show Cash on Delivery at checkout based on any condition (order total, customer country, products in the cart, and more). Configure the app on your store in less than 5 minutes with our simple step-by-step tutorials!   Releasit Cash On Delivery allows you to fully customize the Cash on Delivery payment method on your store. Add a custom fee (fixed value or percentage) to all your COD orders so that you can cover your additional costs and incentivize prepaid orders. Hide or show Cash on Delivery at checkout based on any condition (order total, customer country, products in the cart, and more). Configure the app on your store in less than 5 minutes with our simple step-by-step tutorials!  more         Add a custom fee to Cash on Delivery (fixed value or percentage)         NEW: hide or show Cash on Delivery for any condition (order total, country, ..)         NEW: hide Cash on Delivery for specific products or gift cards         Add an instructions message for COD (reduce RTO and customer confusion)         24/7 support on WhatsApp, Telegram and email    ",Rating (5),226,"July 9, 2021","Cash/collect on delivery (COD), Operations - Other, Cash/collect on delivery (COD), Operations - Other",support@releas.it
"Codisto Amazon, eBay & Walmart "," The easiest way to sell on Amazon, eBay, Google, Walmart and more directly from your online store.  Convert your Shopify store into a fully-featured omnichannel commerce platform, leveraging powerful automation and real-time sync to connect your brand with millions of new customers on the world’s leading online marketplaces. 

Codisto comes ‘launch ready’ meaning there is no re-platforming and no data migration required. 

Focus on growing your Shopify brand and let Codisto’s omnichannel automation drive more traffic, reach new customers, and increase revenue on global marketplaces today!   Convert your Shopify store into a fully-featured omnichannel commerce platform, leveraging powerful automation and real-time sync to connect your brand with millions of new customers on the world’s leading online marketplaces. 

Codisto comes ‘launch ready’ meaning there is no re-platforming and no data migration required. 

Focus on growing your Shopify brand and let Codisto’s omnichannel automation drive more traffic, reach new customers, and increase revenue on global marketplaces today!  more         Sell globally from any store currency, with automated currency conversion         Three unique listing modes to create new listings or link existing ones in bulk         100% real-time sync of inventory, orders, pricing and product details         Manage marketplace orders directly from Shopify         Free 24/7 global support via email, in-app live chat and phone    ",Rating (4.7),964,"September 19, 2017","Online marketplaces, Store data importers, Online marketplaces, Store data importers",support@codisto.com
UpCart—Cart Drawer Cart Upsell ," UpCart lets you create a custom, on-brand slide cart with upsells and add-ons to boost AOV.  UpCart is a full featured drawer cart builder that can automatically help you setup and customize an incredible cart experience. Our carts are designed to look and feel on-brand to the rest of your site. Keep your customers satisfied by providing an easy-to-use cart experience.

Moreover, use UpCart to increase your average order value with our upselling and cross-selling module and add-ons module. Create a sticky cart button to boost conversion rates and reduce cart abandonment.   UpCart is a full featured drawer cart builder that can automatically help you setup and customize an incredible cart experience. Our carts are designed to look and feel on-brand to the rest of your site. Keep your customers satisfied by providing an easy-to-use cart experience.

Moreover, use UpCart to increase your average order value with our upselling and cross-selling module and add-ons module. Create a sticky cart button to boost conversion rates and reduce cart abandonment.  more         Add in-cart upselling and cross-selling blocks to boost your AOV.         Show a free shipping bar or discount promotion bar to incentivize adding items.         Let customers know more about your brand/share updates via cart announcements.         Create an Add-On option for shipping insurance or other products of your choice.         Improve the view cart button\'s visibility with a sticky cart button.    ",Rating (5),272,"July 19, 2021","Cart modification, Upselling and cross-selling, Cart modification, Upselling and cross-selling",support@upcart.app
Hextom: Quick Announcement Bar ," Promote any sales on a fully customizable banner, increase customer awareness and boost sales  Always keeping your customers in the loop about your business updates, promotions, and events is a key element of managing customer relationships. Quick Announcement Bar makes this easier and quicker. You can add a fully customizable banner on your website with a few clicks, inform your customers.

You can have multiple bars shown in rotation or with various animations. You can offer different sales on different bars for different geo locations, customers, pages, etc, and optimize the return.   Always keeping your customers in the loop about your business updates, promotions, and events is a key element of managing customer relationships. Quick Announcement Bar makes this easier and quicker. You can add a fully customizable banner on your website with a few clicks, inform your customers.

You can have multiple bars shown in rotation or with various animations. You can offer different sales on different bars for different geo locations, customers, pages, etc, and optimize the return.  more         Present your sales events with a customized bar, increase awareness and sales         Advanced targeting geo location, customer, page, product, device targeting         Scheduling, you can plan sales in advance for events like Black Friday         Fully customizable with various rotation & animation, background images & styles         Supports all pages, 1-click to enable, no coding required    ",Rating (4.9),"5,399","October 21, 2015","Banners, Discounts, Banners, Discounts",help@hextom.com
