Name,Description,Rating,Reviews,Launched Date,Categories,Support Email
HelpCenter | FAQ Chat Helpdesk ," Improve customer service with FAQ builder, help desk ticketing system, tabs, chatbot & live chat app  Answer your customers’ FAQs before they appear in your inbox with the help of an informative, easy-to-navigate FAQ page. It reduces the support team load and speeds up the response time. Manage inquiries from multiple channels: email, chat or FB Messenger - all in a single Help Desk. Add product descriptions, shipping and other info to product Tabs and improve store navigation. Our app provides Live Chat and automated chatbots that will keep your business accessible in real-time 24/7.   Answer your customers’ FAQs before they appear in your inbox with the help of an informative, easy-to-navigate FAQ page. It reduces the support team load and speeds up the response time. Manage inquiries from multiple channels: email, chat or FB Messenger - all in a single Help Desk. Add product descriptions, shipping and other info to product Tabs and improve store navigation. Our app provides Live Chat and automated chatbots that will keep your business accessible in real-time 24/7.  more         FAQ builder: create a SEO-friendly FAQ page using templates. FAQ translation         Chatbot & Live Chat app: Let your customers contact your business in real-time         Help Desk ticketing system: resolve inquiries from multiple channels in 1 place         Product tabs with descriptions (assign it by product type, collection or vendor)         Contact form: control over the elements, choose from different templates, widget    ",Rating (4.5),"1,307","December 8, 2015","FAQ, Support ticket management, FAQ, Support ticket management",support@helpcenterapp.com
"Plerdy — Heatmap, Replay & SEO "," Plerdy is a powerful tool: heatmap, session replay, SEO, popup survey, eCommerce tracking and more.  Your store doesn\'t convert visitors into customers; you need to find out the reasons for the design, buttons, banner, marketing campaign or something else. Of course, it is difficult to analyze why the user left your store without data, and blind \""optimization\"" by gradual changes takes a lot of time. Plerdy is an analytics tool that shows, based on heatmap data, recording video sessions how users behave on your store. You could survey visitors and offer a discount on your goods with popup forms.   Your store doesn\'t convert visitors into customers; you need to find out the reasons for the design, buttons, banner, marketing campaign or something else. Of course, it is difficult to analyze why the user left your store without data, and blind \""optimization\"" by gradual changes takes a lot of time. Plerdy is an analytics tool that shows, based on heatmap data, recording video sessions how users behave on your store. You could survey visitors and offer a discount on your goods with popup forms.  more         Heatmap — track all of clicks, cursor moves, scroll depth         Session recordings (session replay) — view what each visitor does on your store         Popup — survey customers, collect emails, increase sales and exit intent         SEO — daily analysis titles, descriptions, keywords and Google Search Console         Ecommerce tracking — Find the connection between user behavior and sales.    ",Rating (5),28,"February 15, 2022","Customer analytics, Customer analytics",support@email.plerdy.com
FAQ Page & Help Center Pro ," Easily create SEO-Friendly FAQ, product FAQ, FAQ Accordions pages with 12+ beautiful templates.  Note: If the FAQ demo store asks you for a storefront password, please enter \""123\"".
FAQ Page & Help Center Pro app by DDSHOPAPPS allows customers to look for common inquiries, questions with answers on the Knowledge Base and FAQ lists. Admins can create their own informative SEO-friendly FAQ page with all the necessary features.
Try our FAQs application to see why it is useful to you and trusted by merchants.   Note: If the FAQ demo store asks you for a storefront password, please enter \""123\"".
FAQ Page & Help Center Pro app by DDSHOPAPPS allows customers to look for common inquiries, questions with answers on the Knowledge Base and FAQ lists. Admins can create their own informative SEO-friendly FAQ page with all the necessary features.
Try our FAQs application to see why it is useful to you and trusted by merchants.  more         Show FAQs anywhere: Add FAQs to any page, section, product, collection         Support Google FAQ Schema: FAQs rich results are available, good for SEO         12+ Nice FAQ Page Templates: Easy to change various FAQ page templates         Multi-language FAQs, multiple main FAQ pages         Easy to create, easy to manage, boost sales    ",Rating (4.9),158,"June 15, 2021","FAQ, Store pages - Other, FAQ, Store pages - Other",ddshopapps@gmail.com
Helpful Product Reviews App ," HelpfulCrowd video product reviews makes building trust & making more sales faster and easier!  HelpfulCrowd is great for collecting video, photo or plain text product reviews to build immediate trust with shoppers.
Automatically collect reviews from customers after purchase, import them directly from AliExpress or another app. 
Protect your store brand with full review publishing control.
Drive engagement and conversions with our great looking premium widgets.
Our app does the \'heavy lifting\' to automatically build trust faster, drive more traffic and make more sales.   HelpfulCrowd is great for collecting video, photo or plain text product reviews to build immediate trust with shoppers.
Automatically collect reviews from customers after purchase, import them directly from AliExpress or another app. 
Protect your store brand with full review publishing control.
Drive engagement and conversions with our great looking premium widgets.
Our app does the \'heavy lifting\' to automatically build trust faster, drive more traffic and make more sales.  more         Build trust faster: Collect reviews after sale, migrate, AliExpress import         Drive more traffic: Automated SEO optimization to get found in Google searches         Make more sales: Great looking premium review widgets increases conversion rates         Increase basket value: Q&A with reviews increases value + xsell and upsell tools         Build loyalty: Engage customers, build a relationship and get more repeat sales    ",Rating (5),339,"September 26, 2018","Product reviews, Content marketing - Other, Product reviews, Content marketing - Other",1 (415) 992-7520
WhatsApp Marketing + Helpdesk ," Manage Customer Service on WhatsApp, Instagram, FB, Email, Chat. Send WhatsApp Marketing Broadcasts.  DelightChat\'s omnichannel customer support inbox helps your team streamline customer service, improve team productivity, and become loved by your customers for your amazing service.

Grow your sales by leveraging the power of WhatsApp. Run powerful WhatsApp Broadcasts, marketing automations, retention marketing campaigns using customer segments. We help you get official WhatsApp Business API access for your brand.   DelightChat\'s omnichannel customer support inbox helps your team streamline customer service, improve team productivity, and become loved by your customers for your amazing service.

Grow your sales by leveraging the power of WhatsApp. Run powerful WhatsApp Broadcasts, marketing automations, retention marketing campaigns using customer segments. We help you get official WhatsApp Business API access for your brand.  more         Manage customer chats from WhatsApp, Instagram, Facebook, Email & Live Chat.         Assign chats to team members, reply faster with templates and automations.         Send WhatsApp Broadcast campaigns to your customer lists and increase sales.         Recover Abandoned Carts, send Order Tracking link, increase Retention Marketing.         Get Official WhatsApp Business API access and Green Tick.    ",Rating (4.6),76,"January 25, 2021","Abandoned cart, Support ticket management, Abandoned cart, Support ticket management",support@delight.chat
Helium Customer Fields ," Create customer sign-up forms as unique as your business, and save custom data to customer accounts.  Helium Customer Fields is your one-stop shop to collect and manage customer information.

Create unique registration forms for different customer groups, and collect your customer\'s birthday, pet\'s name, VAT/Tax ID, etc. All customer data is synced with Shopify fields and/or customer metafields. 

Personalize forms with rules and variables, or tag customers automatically based on form input. 

Use our integrations to sync customer data with your business/marketing tools.   Helium Customer Fields is your one-stop shop to collect and manage customer information.

Create unique registration forms for different customer groups, and collect your customer\'s birthday, pet\'s name, VAT/Tax ID, etc. All customer data is synced with Shopify fields and/or customer metafields. 

Personalize forms with rules and variables, or tag customers automatically based on form input. 

Use our integrations to sync customer data with your business/marketing tools.  more         Simple drag-and-drop form builder with field types for nearly any use case         Approve customers by requiring account approval or email verification         Allow customers to edit their own data (name, email, or custom fields)         Configure automatic and/or conditional customer tags to organize customer groups         Developer-friendly! Front-end and back-end APIs are available for custom builds    ",Rating (4.9),285,"July 22, 2015","Customer analytics, Accounts and login, Customer analytics, Accounts and login",support@heliumdev.com
Reamaze Live Chat Helpdesk CRM ," Support and engage customers with live chat, chatbots, FAQ, and automation in a unified team inbox.  Reamaze is a customer support and engagement platform built for eCommerce.

Work faster, look professional, and retain happier customers with support and engagement tools like built-in FAQ, live chat, chatbots, web push notifications, status pages, and surveys, all in a multi-channel and unified team Inbox.

Connect to popular apps to lift efficiency. Use smart macros and automated workflows (AI Intents) with instant access to customer order info to save time and focus on what you do best.   Reamaze is a customer support and engagement platform built for eCommerce.

Work faster, look professional, and retain happier customers with support and engagement tools like built-in FAQ, live chat, chatbots, web push notifications, status pages, and surveys, all in a multi-channel and unified team Inbox.

Connect to popular apps to lift efficiency. Use smart macros and automated workflows (AI Intents) with instant access to customer order info to save time and focus on what you do best.  more         Manage customer support requests from email, chat, social, SMS, voice and more.         Create automated engagement, push, and chatbot prompts w/ AI to get more sales.         Manage, modify, and create Shopify orders directly while talking to customers.    ",Rating (4.6),217,"April 1, 2014","Chat, Support ticket management, Chat, Support ticket management",(408) 520-1217
Retter ‑ Heatmaps & Replay ," Heatmaps & Replay help you record visitor activity, to see how they interact with your store.  Retter helps you see where your visitors clicked, scrolled, moved, or tapped. Replay how your visitors interact with your products, collections, pages, carts, and what made them abandon your store. Using Session Record & Replay is a must.

More over we provide Dynamic Heatmaps that help you understand which part of your pages are the most interactive & help you make smart decisions to improve your store and boost your conversions over time. Session Recording & Replay + Heatmap help to improve UX   Retter helps you see where your visitors clicked, scrolled, moved, or tapped. Replay how your visitors interact with your products, collections, pages, carts, and what made them abandon your store. Using Session Record & Replay is a must.

More over we provide Dynamic Heatmaps that help you understand which part of your pages are the most interactive & help you make smart decisions to improve your store and boost your conversions over time. Session Recording & Replay + Heatmap help to improve UX  more         Record & Replay help you understand your visitor with location, browser, session         Heatmaps help you understand which part of your page is interactive         Replay recordings is just like DVR, see where your visitors click, scroll & move         Heatmap & Replay help Identify landing page problems and improve your sales         Get a deep understanding how your customer interact with the store by replays    ",Rating (4.7),41,"May 21, 2021","Customer analytics, Marketing analytics, Customer analytics, Marketing analytics",support@upify.io
Happy Birthday Marketing ," Offer birthday discounts + boost revenue with email marketing!  Improve customer engagement and loyalty by offering exclusive promotion emails on your customer\'s birthday! This is a great way to reactivate relations with customers that haven\'t been active in a while!

Happy Birthday Marketing is a new player on the Shopify app store. Merchants who sign up now are guaranteed free lifetime access as early adopters!

No need to wait around for support to install code on your Shopify theme. Get up and running in 10 minutes or less   Improve customer engagement and loyalty by offering exclusive promotion emails on your customer\'s birthday! This is a great way to reactivate relations with customers that haven\'t been active in a while!

Happy Birthday Marketing is a new player on the Shopify app store. Merchants who sign up now are guaranteed free lifetime access as early adopters!

No need to wait around for support to install code on your Shopify theme. Get up and running in 10 minutes or less  more         Customize birthday discount email copy, colors, logo image, etc         Birthday signup on thank you page (order status page) shown after order is made         Birthday signup landing page you can link to on your website + emails         Post purchase page birthday signup to improve conversion even more         Sync birthday with customer Klaviyo profile    ",Rating (5),7,"July 11, 2022","Discounts, Email marketing, Discounts, Email marketing",support@northern-apps.com
POWR: FAQ Page | Help Center ," Create, organize and display Frequently Asked Questions (FAQ) to help support customers on any page.  It\'s often that site visitors need more information before completing a purchase. You can also reduce phone calls and emails by answering questions directly on your site. Include an FAQ section on each page, or create a Help Center page for your website. Provide customer support with FAQs and answers like telling site visitors about your business by answering \""Why Us?\"", shipping details, return/cancellation/refund policies, and product information or uses.   It\'s often that site visitors need more information before completing a purchase. You can also reduce phone calls and emails by answering questions directly on your site. Include an FAQ section on each page, or create a Help Center page for your website. Provide customer support with FAQs and answers like telling site visitors about your business by answering \""Why Us?\"", shipping details, return/cancellation/refund policies, and product information or uses.  more         Make your FAQ searchable with a search bar         Customize sections, alignment, labels, icons, and much more         Choose hover or mouse-over effect         Activate upvote or downvote on answers         Add links, images, and videos to FAQs    ",Rating (4.4),226,"January 8, 2016","FAQ, Page builder, FAQ, Page builder",appsupport@powr.io
Draft Order Helper ," The app allows further customization on draft order, and add discount code  With this app, you can create a checkout from draft order which allows customer/ you to input discount code, saving hassles of manually calculating discount.
Add more info to the draft order such as line item properties, order notes, and also rearrange line items without having to recreate it.

Deduct inventories of the products in the draft order, to prevent overselling while the draft order is pending payment.

You can convert abandoned checkout to draft order while preserving properties.   With this app, you can create a checkout from draft order which allows customer/ you to input discount code, saving hassles of manually calculating discount.
Add more info to the draft order such as line item properties, order notes, and also rearrange line items without having to recreate it.

Deduct inventories of the products in the draft order, to prevent overselling while the draft order is pending payment.

You can convert abandoned checkout to draft order while preserving properties.  more         Create a checkout from draft order, and let customer apply discount code         Add line item properties or order notes to draft order         Deduct inventories of the line items of the draft order with 1 click         Rearrange order of line items for your draft order         Create a draft order from abandoned checkout, with the properties from products    ",Rating (5),6,"June 4, 2021","Abandoned cart, Discounts, Abandoned cart, Discounts",axel@draftorder.app
eDesk ‑ Help Desk & Live Chat ," eDesk unifies all your customer conversations and order history into an AI-powered growth center  eCommerce brands often face some challenges to scaling customer satisfaction as they expand their sales and support channels. 

Our All-In-One Helpdesk enables online retailers like you to deliver fast and accurate customer service from all your channels in one place, automate common queries and turn every customer interaction into a sale. 

Leverage customer intelligence to drive loyalty, repurchase, and sustainable growth, with eDesk: the All-In-One Helpdesk for E-commerce.   eCommerce brands often face some challenges to scaling customer satisfaction as they expand their sales and support channels. 

Our All-In-One Helpdesk enables online retailers like you to deliver fast and accurate customer service from all your channels in one place, automate common queries and turn every customer interaction into a sale. 

Leverage customer intelligence to drive loyalty, repurchase, and sustainable growth, with eDesk: the All-In-One Helpdesk for E-commerce.  more         Smart Inbox: Centralize all of your support and share it across your team         Integration: consolidate orders and tickets, from 250+ channels, in one place         AI-powered Automations: Automate more than you ever thought possible         Customer View: Save agents and shoppers time with a 360° view of customers         Live Chat: Utilize Live Chat for higher conversions and more sales    ",Rating (4.8),30,"July 12, 2016","Chat, Support ticket management, Chat, Support ticket management",1 917 6882333
Crisp ‑ Helpdesk & Live Chat ," Centralize channels, gather teams, and synchronize e-commerce customer data, all in one platform.  Crisp is an e-commerce multichannel help desk platform that helps small and medium online stores around the world to connect instantly with buyers or leads who are waiting for help.

With its quickly evolving set of tools, Crisp is helping Shopify store owners to navigate through the omnichannel-driven revolution by using conversations to unlock better word of mouth.

Take advantage of chatbots, live chat, and dedicated FAQ to create the perfect helpdesk for your e-commerce business.   Crisp is an e-commerce multichannel help desk platform that helps small and medium online stores around the world to connect instantly with buyers or leads who are waiting for help.

With its quickly evolving set of tools, Crisp is helping Shopify store owners to navigate through the omnichannel-driven revolution by using conversations to unlock better word of mouth.

Take advantage of chatbots, live chat, and dedicated FAQ to create the perfect helpdesk for your e-commerce business.  more         Centralize 12 channels  - Emails, live chat, Instagram DM, Messenger, Phone ...         Preview carts, check order history, and issue refunds straight from your Inbox         Dedicated FAQ page builder to craft the best help desk system         Chatbot builder with pre-made scenarios to resolve issues and increase sales         Add Crisp Live Chat to your online store in 30 seconds    ",Rating (4.6),5,"December 16, 2022","Chat, Support ticket management, Chat, Support ticket management",support@crisp.chat
Website Heatmap Software ," New website heatmap software with revenue attribution. Tracks all clicks, conversions and revenue.  SquidVision is a super cool conversion rate optimization and analytics tool that shows you how much revenue every button and link on your website generates. 

Is your main CTA working like it should?

Are your products listed in the optimal order?

Is your content marketing driving sales?

Now you can easily do better conversion rate optimization (CRO) by seeing which buttons, links and images are generating your revenue.   SquidVision is a super cool conversion rate optimization and analytics tool that shows you how much revenue every button and link on your website generates. 

Is your main CTA working like it should?

Are your products listed in the optimal order?

Is your content marketing driving sales?

Now you can easily do better conversion rate optimization (CRO) by seeing which buttons, links and images are generating your revenue.  more         Revenue Heatmaps that show how much revenue each button and link generate.         Track revenue on blog post CTA\'s to validate content marketing strategy.         Run heatmaps on AB tests on landing pages to quickly increase conversions.    ",Rating (4.7),11,"September 5, 2022","Sales analytics, Content marketing - Other, Sales analytics, Content marketing - Other",support@squidvision.com
Richpanel Helpdesk & Live Chat ," Automate your support tickets and let agents convert more visitors to purchase.  Gain customer loyalty with a hassle-free customer experience and turn customer service into a revenue channel with Richpanel -the help desk purpose-built  to make customer support easy. Centralize all order and customer conversation history from all channels in one inbox view. Automate customer service without frustrating customers by using Amazon-like customer self-service that provide instant resolutions. Effortlessly personalize at scale and drive sales from conversations.   Gain customer loyalty with a hassle-free customer experience and turn customer service into a revenue channel with Richpanel -the help desk purpose-built  to make customer support easy. Centralize all order and customer conversation history from all channels in one inbox view. Automate customer service without frustrating customers by using Amazon-like customer self-service that provide instant resolutions. Effortlessly personalize at scale and drive sales from conversations.  more         Provide instant resolutions with self-service flows and no agent involvement         Manage tickets from Email, SMS, Social Media (comments and DMs) in a single view         Quickly understand customer needs with complete order and conversation history         View, edit, cancel and create orders without leaving the help desk inbox         Measure revenue and performance of agents with support analytics and dashboards    ",Rating (5),102,"November 15, 2019","Customer order tracking, Support ticket management, Customer order tracking, Support ticket management",1-415-498-1118
Handshake for Suppliers ," Handshake is Shopify’s handpicked wholesale marketplace for one-of-a-kind US brands.  Every day, Handshake helps thousands of approved retailers discover and order unique products from professional, quality brands – all carefully curated by Shopify.

Handshake is 100% built by Shopify. That means one integrated platform for managing all your products, orders, and buyers. Once your application to sell is approved, you\'ll own your brand profile on Handshake, and manage everything from Shopify.

Product categories include Apparel, Jewelry, Beauty, Food & Drink, Stationary, and more.   Every day, Handshake helps thousands of approved retailers discover and order unique products from professional, quality brands – all carefully curated by Shopify.

Handshake is 100% built by Shopify. That means one integrated platform for managing all your products, orders, and buyers. Once your application to sell is approved, you\'ll own your brand profile on Handshake, and manage everything from Shopify.

Product categories include Apparel, Jewelry, Beauty, Food & Drink, Stationary, and more.  more         Manage products in Shopify         Reach new buyers         Join for free    ",Rating (1),25,"June 8, 2021","Finding suppliers, Finding suppliers",help@handshake.com
