Name,Description,Rating,Reviews,Launched Date,Categories,Support Email
Product + Upsell A/B Testing ," Easily A/B test product prices, images, titles, descriptions + more (split + conversion testing)  A/B testing is the best way to optimize your product details and optimize your conversion. By creating live experiments you can see exactly what product details work and what product details don\'t work.

Product + Upsell A/B Testing installs automatically. No need to copy/paste code or wait for support. Create your first A/B test and start testing your products in minutes!

Our app is designed to work for all Shopify merchants, doesn’t slow down your website, and doesn\'t require a subscription   A/B testing is the best way to optimize your product details and optimize your conversion. By creating live experiments you can see exactly what product details work and what product details don\'t work.

Product + Upsell A/B Testing installs automatically. No need to copy/paste code or wait for support. Create your first A/B test and start testing your products in minutes!

Our app is designed to work for all Shopify merchants, doesn’t slow down your website, and doesn\'t require a subscription  more         A/B test prices, titles, descriptions, and images to optimize conversion         Track views, add to carts, orders + revenue to see what changes work best         A/B test post purchase upsells to increase AOV + boost revenue    ",Rating (4.7),7,"September 17, 2021","Upselling and cross-selling, Upselling and cross-selling",chris@northern-apps.com
FigPii AB Testing & Replays ," FigPii will help you find the actionable data and turn them into conversions on your site.  FigPii analyzes heaps of data on your site, pinpoints where visitors are struggling, and the exact changes you should make to improve your site.

Using a combination of your visitor data and the largest dataset of site improvements, FigPii suggests actual changes you should make on your site.

With FigPii you get Heatmaps, Session Replays, A/B testing, Polls, and more.   FigPii analyzes heaps of data on your site, pinpoints where visitors are struggling, and the exact changes you should make to improve your site.

Using a combination of your visitor data and the largest dataset of site improvements, FigPii suggests actual changes you should make on your site.

With FigPii you get Heatmaps, Session Replays, A/B testing, Polls, and more.  more         A/B Testing with an easy-to-use interface and wizard         Visualize where visitors click using Heatmaps         Record & replay visitor actions on your site         Hear directly from visitors through polls    ",Rating (4.7),54,"December 15, 2021
          ·","Customer analytics, Store activity, Customer analytics, Store activity",+1.248.270.3325
Easy Ads for Facebook Ads ," Easy Ads for Facebook helps you launch a full advertising funnel on Facebook and Instagram fast.  Easy Ads for Facebook helps you launch a powerful advertising funnel in minutes to promote your products profitably and grow sales.

Super easy to learn and fast to set up, you can get a campaign with a solid marketing strategy up and running on Facebook and Instagram in a few minutes without worrying about audience targeting, ad creative creation, or campaign setup.   Easy Ads for Facebook helps you launch a powerful advertising funnel in minutes to promote your products profitably and grow sales.

Super easy to learn and fast to set up, you can get a campaign with a solid marketing strategy up and running on Facebook and Instagram in a few minutes without worrying about audience targeting, ad creative creation, or campaign setup.  more         Launch a powerful advertising funnel on Facebook and Instagram in a few minutes.         Optimize your ads more effectively than ever with automatic AI optimization.         Easily track KPIs and measure your ad funnel performance in a clear dashboard.         Activate our done-for-you advertising funnel strategy to grow your sales.         No need to stress audience targeting, ad creation, or product feed creation.    ",Rating (4.7),28,"August 30, 2022","Marketing analytics, Marketing analytics",support@easyadsapp.com
The Shop Events Calendar ," Calendar widget that helps your store showcase events and promos using your theme options  The Shop Events Calendar focuses on one thing, and one thing only. A straight-forward, easy to install, mobile friendly calendar widget.

Showcase your events, promotions, announcements, product releases and more on a mobile-friendly calendar. 

Choose from two calendar designs: original or list view, and customize the calendar options so that it appears exactly the way you want it.   The Shop Events Calendar focuses on one thing, and one thing only. A straight-forward, easy to install, mobile friendly calendar widget.

Showcase your events, promotions, announcements, product releases and more on a mobile-friendly calendar. 

Choose from two calendar designs: original or list view, and customize the calendar options so that it appears exactly the way you want it.  more         Unlimited Event Creation. Create an unlimited amount of events for your calendar         Your store, Your Calendar. The calendar uses your stores themes and fonts.         Integrate Your Other Calendars. Take your calendars from Google, Apple and more.         Quick Calendar Install. Use the 1-click install or embed the calendar yourself.         Calendar Translations. Translate your calendar to a variety of languages.    ",Rating (5),66,"July 8, 2020","Event calendar, Event calendar",theshopapps@gmail.com
Wishlist King ," A fully customisable wishlist enhancing your customers’ shopping flow & assisting you in conversion.  Wishlist King enables customers to keep track of their favourite products and makes it easier for them to purchase when ready. You will get insights of what is popular and the ability to help nudge them over the line via wishlist related emails. Wishlist King is an easy hands-off app that enhances the shopping flow, ultimately assisting in sales by making it more convenient for merchants to curate favourites. We can migrate and import existing wishlists from other apps to help you switch to us.   Wishlist King enables customers to keep track of their favourite products and makes it easier for them to purchase when ready. You will get insights of what is popular and the ability to help nudge them over the line via wishlist related emails. Wishlist King is an easy hands-off app that enhances the shopping flow, ultimately assisting in sales by making it more convenient for merchants to curate favourites. We can migrate and import existing wishlists from other apps to help you switch to us.  more         Start a wishlist with 1 click and add products from anywhere. Accounts optional.         Integrates seamlessly with all themes, no popups or generic look and feel.         Free setup and customisations by us to ensure everything looks and works great.         Klaviyo integration allowing you to send email reminders via various triggers.         Full functionality and no usage restrictions on all plans.    ",Rating (4.9),289,"November 30, 2015","Wishlists, Wishlists",support@appmate.io
VolumeBoost ‑ Volume Discount ," Create discounted prices for bulk purchases with the VolumeBoost - Volume Discount app.  The VolumeBoost-Volume Discount app makes it easy to launch discounted price campaigns that include numerous discount types, a cart-saving message, and import/export offers to raise average order value and match custom-tiered pricing to your online store. It\'s great for wholesale pricing, bringing in new customers, and giving existing customers special discounts as a reward.   The VolumeBoost-Volume Discount app makes it easy to launch discounted price campaigns that include numerous discount types, a cart-saving message, and import/export offers to raise average order value and match custom-tiered pricing to your online store. It\'s great for wholesale pricing, bringing in new customers, and giving existing customers special discounts as a reward.  more         Effortlessly implement a discount coupon box right on your cart page.         It allows you to create and store more than one customer tag.         Manage and limit the quantity of your bulk discount offers with ease.         Easily display custom messages with VolumeBoost in your cart section.         The bulk discounts can be enabled in countries you wish to select.    ",Rating (4.6),"1,051","February 27, 2018
          ·","Discounts, Wholesale pricing, Discounts, Wholesale pricing",(773) 831-9374
Gift Card Pro ," Make Gift Cards Easy To Gift! An Easier Way For Your Customers To Buy & Send Gift Cards Directly.  With Gift Card Pro, your customers can now send digital Gift Cards directly to recipients via Email or Text. When a customer goes through the Gift Card purchasing process on your store, they can choose from multiple Gift Card designs, add a pre-set or custom monetary value, include a written gift message, record a video message, and select a specific date and time that they would like the Gift Card to be delivered. You can choose the options your customers see, and build a unique experience.   With Gift Card Pro, your customers can now send digital Gift Cards directly to recipients via Email or Text. When a customer goes through the Gift Card purchasing process on your store, they can choose from multiple Gift Card designs, add a pre-set or custom monetary value, include a written gift message, record a video message, and select a specific date and time that they would like the Gift Card to be delivered. You can choose the options your customers see, and build a unique experience.  more         Customers can schedule send Gift Cards via Email or Text Message.         50 Beautiful Gift Card Designs Included. Or Upload Your Own!         Pre-set / Custom Gift Card values. Add specific Gift Card values to choose from.         Personalized Gift Cards With Gift Messages Or Recorded Videos Messages!         NEW: Bulk Ordering. Send To Up To 1,000 Different Email Recipients In One Order.    ",Rating (5),65,"February 21, 2022","Gift cards, Gift cards",+1 (236) 300-1123
Mobile App Builder ‑ Swipecart ," No code mobile app builder to convert your store into a mobile application  Swipecart, a mobile app builder, focuses on increasing mobile conversions, recurring orders, and brand revenue.

Without the necessity of code, push real-time updates about products, inventory, prices, and promotional offers. Get access to unlimited push notifications. This means you won\'t have to depend upon ads to re-engage with your existing customers. Our team will guide you towards your mobile app success from the very start to the finish line.   Swipecart, a mobile app builder, focuses on increasing mobile conversions, recurring orders, and brand revenue.

Without the necessity of code, push real-time updates about products, inventory, prices, and promotional offers. Get access to unlimited push notifications. This means you won\'t have to depend upon ads to re-engage with your existing customers. Our team will guide you towards your mobile app success from the very start to the finish line.  more         iOS and Android Mobile application for your store         Abandoned card recovery through abandoned cart push notifications         Audience segmentation and details app usage analytics    ",Rating (4.9),48,"August 5, 2022","Mobile app builder, Mobile app builder",7603899794
Happy Returns a PayPal company ," We make returns beautiful for shoppers, merchants, and the planet.  We provide end-to-end returns solutions through a unique combination of returns software and reverse logistics. Through our nationwide network of Return Bar locations, we delight shoppers by enabling them to drop off returns with no packaging or printing in under 60 seconds. Returns are aggregated and shipped using reusable totes, reducing costs for merchants and increasing sustainability by reducing cardboard waste and carbon emissions.   We provide end-to-end returns solutions through a unique combination of returns software and reverse logistics. Through our nationwide network of Return Bar locations, we delight shoppers by enabling them to drop off returns with no packaging or printing in under 60 seconds. Returns are aggregated and shipped using reusable totes, reducing costs for merchants and increasing sustainability by reducing cardboard waste and carbon emissions.  more         Automate returns and exchanges via a branded return portal         Customize return reasons and refund methods, apply policy rules automatically         Convert refunds into revenue with Return Shopping and one-click exchanges         Save up to 40% on return shipping with our network of 5,000+ Return Bars         Utilize powerful real-time returns tracking and reporting directly in Shopify    ",Rating (3.1),14,"November 12, 2020","Returns and exchanges, Returns and exchanges",retailer-support@happyreturns.com
ShipBob Fulfillment ," ShipBob partners with DTC and B2B brands to pick, pack, and ship orders across 40+ global locations.  With ShipBob, e-commerce brands get world-class logistics for all your sales channels, globally. Showcase your brand by using our full customization suite - packaging, inserts, and more. Online orders are picked, packed, and shipped same-day, using the delivery speed you choose. Have B2B/Wholesale orders? ShipBob can manage the retailer compliance, including EDI documents. And with 40+ warehouses across 6 countries, ShipBob can grow with you.   With ShipBob, e-commerce brands get world-class logistics for all your sales channels, globally. Showcase your brand by using our full customization suite - packaging, inserts, and more. Online orders are picked, packed, and shipped same-day, using the delivery speed you choose. Have B2B/Wholesale orders? ShipBob can manage the retailer compliance, including EDI documents. And with 40+ warehouses across 6 countries, ShipBob can grow with you.  more         Same-day shipping ensures your customers\' orders arrive on time.         Our Customization Suite allows you to build your own unboxing experience.         Expand globally with duties-paid shipping options and warehouses in 6 countries.         B2B/EDI compliance managed for you in-house for your retail expansion needs.         Free, easy-to-use Shopify integration, plus REST APIs for ERPs (e.g. Netsuite)    ",Rating (4.4),158,"February 19, 2021","Outsourced fulfillment, Outsourced fulfillment",1 (312)-313-1104
"Yanet: FAQ Page, Product FAQs "," FAQ page app help merchant build a flexible FAQ page with an existed template and a custom style  Professional FAQ app helps merchants create a nice FAQ page without coding skills in a few minutes. Responsive and many clever themes available. Native store language translation. Merchant can show FAQs on product page. Wealthy text editor for answers and categories. Customizable FAQ page URL. Enable customer to seek out for FAQ on search bar. Custom CSS FAQ to look nice on FAQ page. Template live preview. FAQs import and export   Professional FAQ app helps merchants create a nice FAQ page without coding skills in a few minutes. Responsive and many clever themes available. Native store language translation. Merchant can show FAQs on product page. Wealthy text editor for answers and categories. Customizable FAQ page URL. Enable customer to seek out for FAQ on search bar. Custom CSS FAQ to look nice on FAQ page. Template live preview. FAQs import and export  more         Unlimited FAQ, Category: merchant can add many FAQs, categories         Product FAQ: display FAQs to product page to increase sales and conversion rate         Multi-language support: can translate FAQs to any language that you want         Google SEO snippets support         Many professional templates for a beautiful FAQ page    ",Rating (5),47,"May 19, 2022","FAQ, Store pages - Other, FAQ, Store pages - Other",support@yanet.io
Contact Us Form with Captcha ," Create a professional and easy-to-use contact form with our powerful Contact Us Form app.  The HulkApps Contact Us Form with Captcha app is an easy-to-use, fully responsive, and customizable form builder app that lets you add a contact form to your current store theme and set up auto-responders for all form submissions. You can also change the number and types of fields that must be filled out on the contact forms. With a one-step database, it is easier to track all your entries and never lose a significant lead again.   The HulkApps Contact Us Form with Captcha app is an easy-to-use, fully responsive, and customizable form builder app that lets you add a contact form to your current store theme and set up auto-responders for all form submissions. You can also change the number and types of fields that must be filled out on the contact forms. With a one-step database, it is easier to track all your entries and never lose a significant lead again.  more         Customize your Contact Form with six customizable fields to match your store.         Create the form by yourself and add it to your Contact Page.         You can build a worthwhile email list through the contact form you create.         Built-in reCAPTCHA element that protects against spam and abuse.         Easily export submission forms in a format that sorts them by date.    ",Rating (4.7),291,"September 8, 2017
          ·","Contact form, Feedback and surveys, Contact form, Feedback and surveys",872-205-1773
Multi Vendor Marketplace ," Convert your ECommerce Store to a Fully Fledged Marketplace. 
Earn commission on seller\'s orders.  This module is a great tool to convert your shop into a fully functioning marketplace. It facilitates the process of adding sellers and keep track of their sales. Sellers (or vendors) can have their own profile and collection page with variety of products. Admin (or merchant) can easily set individual commission and global commission for all the sellers. The Sellers can add Unlimited Products. Sync products from Sellers with Shopify Store, Wordpress Store, Prestashop Store or Magento Store.   This module is a great tool to convert your shop into a fully functioning marketplace. It facilitates the process of adding sellers and keep track of their sales. Sellers (or vendors) can have their own profile and collection page with variety of products. Admin (or merchant) can easily set individual commission and global commission for all the sellers. The Sellers can add Unlimited Products. Sync products from Sellers with Shopify Store, Wordpress Store, Prestashop Store or Magento Store.  more         Admin can set global commission & can also set separate commission for sellers.         Product /Seller added through CSV file. Products bulk edit by CSV.         Admin can assign existing product to the sellers.         Seller can have their own ‘Profile Page’ on the store.         Partner Friendly.    ",Rating (4.5),589,"April 20, 2015","Finding suppliers, Finding suppliers",(+91)-9870284067
MY ONLINE FASHION STORE ," We are wholesale company based in USA providing access to over 6000 ready to ship fashion items.  Utilizing our app will provide you with instant access to over 6000 items, with over 200 new styles added every other week. No more shipping delays, all items will be shipped from our warehouse in Los Angeles, CA., Easily pick and choose items you want to sell in your store, with just few simple clicks. All our items are sources from manufacturers based in Los Angeles, to insure merchandise we carry are high quality and true to size. We also offer Free return service as well as custom packaging.   Utilizing our app will provide you with instant access to over 6000 items, with over 200 new styles added every other week. No more shipping delays, all items will be shipped from our warehouse in Los Angeles, CA., Easily pick and choose items you want to sell in your store, with just few simple clicks. All our items are sources from manufacturers based in Los Angeles, to insure merchandise we carry are high quality and true to size. We also offer Free return service as well as custom packaging.  more         Fast Shipping & Free Returns
Guaranteed 5-7 day delivery 
Hassle Free Returns         Huge Catalog w/ Low Prices
Over 6000 Skus in Stock with high profit margins.         Responsive Customer Support
Support Available via phone, email and live chat.    ",Rating (4.3),258,"November 7, 2017","Dropshipping, Finding suppliers, Dropshipping, Finding suppliers",866.298.8402
qikify Smart Menu ‑ Mega Menu ," Easily create a mega menu for your store without any coding. Pre-designed templates are provided.  With qikify Smart Menu you can easily create a mega menu to enhance store’s design and increase conversion without coding. qikify Smart Menu helps you quickly and easily to create a mega menu with pre-designed templates and an unlimited number of menu items. Customization helps improve your store design and enhance customer experience by providing clear and flexible navigation.  You can boost sales by promoting featured products, collections, and banners with flexible widgets.   With qikify Smart Menu you can easily create a mega menu to enhance store’s design and increase conversion without coding. qikify Smart Menu helps you quickly and easily to create a mega menu with pre-designed templates and an unlimited number of menu items. Customization helps improve your store design and enhance customer experience by providing clear and flexible navigation.  You can boost sales by promoting featured products, collections, and banners with flexible widgets.  more         Add Product, Collection (support filter by tags), Pages and custom links in menu         Create menu with block items, contact form, google map and custom HTML         Add eye-catching labels, badges, icons to attract customers to special deals         Fullly customize (font, color, size, etc) and unlimited number of menu items         Create multi-level menu with templates (mega menu, tabs menu, tree menu, etc)    ",Rating (4.9),694,"September 26, 2018","Navigation and filters, Navigation and filters",support@qikify.zohodesk.com
Post‑Purchase Survey Question ," Create a post-purchase survey. Get to know customers\' experience to make the products better.  What could you tell me about your customers if I asked you these few simple questions:

* Where do most of them find out about you?
* Who else do they consider buying from?
* What product are they looking for next?

If you’re not the brand that knows the most about your customers then some other brands are, and that’s a huge advantage.

This app provides a tool to grow your business, and why understanding your customers’ experience is essential to creating better products.   What could you tell me about your customers if I asked you these few simple questions:

* Where do most of them find out about you?
* Who else do they consider buying from?
* What product are they looking for next?

If you’re not the brand that knows the most about your customers then some other brands are, and that’s a huge advantage.

This app provides a tool to grow your business, and why understanding your customers’ experience is essential to creating better products.  more         Customisable survey question         Survey revenue analysis         Works with all themes    ",Rating (4.8),50,"March 2, 2021","Order tagger, Popups, Order tagger, Popups",app@roartheme.com
UpCount: Live Visitors Counter ," Increase scarcity, social proof & trust by showing a live visitors counter in your products pages.  UpCount allows you to easily add a live visitors counter that visually shows the number of product page views that a certain product had in a designated timeframe. Showing a live product views counter in your product pages can create a sense of social proof and trust within your customers and increase conversion

UpCount is highly configurable: You can style it in order to fully match your store\'s style and control the minimum number of visitors that\'s required in order for the counter to appear   UpCount allows you to easily add a live visitors counter that visually shows the number of product page views that a certain product had in a designated timeframe. Showing a live product views counter in your product pages can create a sense of social proof and trust within your customers and increase conversion

UpCount is highly configurable: You can style it in order to fully match your store\'s style and control the minimum number of visitors that\'s required in order for the counter to appear  more         Create social proof & trust with a live visitors counter that counts page views.         Create scarcity within customers by showing them that more visitors are watching         Highly customizable design: Match the product views counter style to your store.         Control the minimum number of visitors that\'s required to show the views counter         Control whether returning visitors will be counted or only new unique visitors.    ",Rating (4.8),38,"January 5, 2021","Visitor counter, Visitor counter",support@effectify.co
