Name,Description,Rating,Reviews,Launched Date,Categories,Support Email
ShopifyQL Notebooks ," ShopifyQL Notebooks lets you explore, visualize, and analyze shop data to make better decisions.  ShopifyQL Notebooks help you bring together metrics from different business domains so you can explore, visualize and analyze shop data to make better business decisions. Your data exploration is guided by ShopifyQL - an intelligent query language that has commerce syntax built into it. You can now write simple queries to quickly get access to data and add business context via images or text, all within a single interface.   ShopifyQL Notebooks help you bring together metrics from different business domains so you can explore, visualize and analyze shop data to make better business decisions. Your data exploration is guided by ShopifyQL - an intelligent query language that has commerce syntax built into it. You can now write simple queries to quickly get access to data and add business context via images or text, all within a single interface.  more         Visualize and analyze shop data with a powerful query editor.         Get to answers quickly, using a query language built with commerce syntax.         Use the presentation mode to share your data story with business stakeholders    ",Rating (4),2,"October 31, 2022","Store data - Other, Analytics - Other, Store data - Other, Analytics - Other",plusspecialists@shopify.com
FLATLAY Social Commerce ," Flatlay is the end to end social commerce automation platform for brands, creatives & customers.  The platform provides publishing tools for anyone to start a digital storefront in seconds while empowering brands and retailers with a SaaS portal to activate a community of customers and advocates to source content from and fuel sales.

Brands & retailers connect their product feeds along with syncing social channels and newsletter data into the workflow management system to run campaigns with their customers and advocates.

We\'re here to scale up your customer referral programs at ease!   The platform provides publishing tools for anyone to start a digital storefront in seconds while empowering brands and retailers with a SaaS portal to activate a community of customers and advocates to source content from and fuel sales.

Brands & retailers connect their product feeds along with syncing social channels and newsletter data into the workflow management system to run campaigns with their customers and advocates.

We\'re here to scale up your customer referral programs at ease!  more         Creator Discovery & Community Building Across Social         Gift Product & Run Promotions That Generate User Generated Content         Generate Affiliate Sales & Product Referrals Through a Content Loyalty Program    ",Rating (5),75,"June 11, 2021","Online marketplaces, Online marketplaces",support@theflatlay.com
EZ Importer ‑ Order Importer ," Bulk import orders, or migrate orders from other platforms saving you from tedious manual data entry  EZ Importer allows you to easily bulk import your orders to Shopify via CSV.  Our column mapping system enables you to map the columns in your CSV file to the appropriate Shopify fields.  We have custom-built templates to help you import from another Shopify store and many other platforms.

Try risk-free when you install the app.  Delete imports and get credits added back to your credit bank.  Re-import as much as you need!   EZ Importer allows you to easily bulk import your orders to Shopify via CSV.  Our column mapping system enables you to map the columns in your CSV file to the appropriate Shopify fields.  We have custom-built templates to help you import from another Shopify store and many other platforms.

Try risk-free when you install the app.  Delete imports and get credits added back to your credit bank.  Re-import as much as you need!  more         Bulk import orders from any source using our built-in data mapper.         Import multiple line items per order, customer data, transactions, and taxes         Reduce product inventory on import using our configuration options.         Built-In templates to migrate from another Shopify store, and other platforms.         Migrate from Magento, Wix, Kickstarter, 3dart, Squarespace, and more.    ",Rating (4.9),102,"June 21, 2017","Store data importers, Store data importers",support@highviewapps.com
ViVA Reviews ‑ Product Reviews ," Drive sales by displaying customer reviews on your shop.  Import reviews from Aliexpress.  ViVA Reviews allows you to increase your store conversion & sales through the power of social proof. 

Add, accept and show real user reviews on your product pages in a snap.  Seamlessly import reviews from Aliexpress with a couple clicks.

Build social proof on your product pages instantly. Increase brand awareness and maximize sales with the power of customer reviews.

Save time by using our A.I. Review finder, further automating the process of collecting reviews.   ViVA Reviews allows you to increase your store conversion & sales through the power of social proof. 

Add, accept and show real user reviews on your product pages in a snap.  Seamlessly import reviews from Aliexpress with a couple clicks.

Build social proof on your product pages instantly. Increase brand awareness and maximize sales with the power of customer reviews.

Save time by using our A.I. Review finder, further automating the process of collecting reviews.  more         Save time and get better reviews using our A.I. powered review finder         Import reviews from Aliexpress that match your preferences including language.         Improve Google SEO visibility with review ratings shown on search result pages         Improve brand awareness by displaying reviews from your customers    ",Rating (4.6),16,"July 23, 2021","Product reviews, Product reviews",info@vivareviews.com
Smart Seo Boost ," Optimises product meta-descriptions to increase search engine ranking and increase organic traffic.  By optimising your store for search engines such as Google, Bing, and Yahoo, you can significantly increase your sales and profit since organic traffic does not cost you anything, unlike paid Google or Facebook ads. 

Smart SEO Boost optimises your products so search engines can easily find them. It does this by renaming your alt image text, so it complies with search engine crawlers.
You click start, and Smart SEO Boost will work in the background continuously 24 hours, seven days a week.   By optimising your store for search engines such as Google, Bing, and Yahoo, you can significantly increase your sales and profit since organic traffic does not cost you anything, unlike paid Google or Facebook ads. 

Smart SEO Boost optimises your products so search engines can easily find them. It does this by renaming your alt image text, so it complies with search engine crawlers.
You click start, and Smart SEO Boost will work in the background continuously 24 hours, seven days a week.  more         Increase search traffic by improving search engine ranking         Improve the chances of ranking your high traffic keywords.         Grow your sales organically with improved search engine visibility.    ",Rating (4.4),54,"March 4, 2022","SEO, Search engine optimization - Other, SEO, Search engine optimization - Other",contact@brainiosoftware.com
Uplinkly Sticky Cart ," Show sticky add to cart buttons on your product pages. This increases sales and reduces abandonment.  Allow your customers to quickly add to cart and buy your products.

Lengthy product info can make add to cart buttons hard to find.  However, a sticky add to cart is always highly visible.  So your customers can buy now, add to cart and checkout faster. 

Our one click install saves time by adding a sticky add to cart that seamlessly integrates into your store.

Use our built in reporting to easily see your sales increases and use with your Google Analytics and Facebook Pixel.   Allow your customers to quickly add to cart and buy your products.

Lengthy product info can make add to cart buttons hard to find.  However, a sticky add to cart is always highly visible.  So your customers can buy now, add to cart and checkout faster. 

Our one click install saves time by adding a sticky add to cart that seamlessly integrates into your store.

Use our built in reporting to easily see your sales increases and use with your Google Analytics and Facebook Pixel.  more         Automatically match your store theme with high converting styles.         Use our button Animator to attract more attention and \'move\' the button.         Display at the top or bottom and customize text.         Visible and responsive to your customers on mobile, desktop & tablet.         Unlimited impressions and clicks included.    ",Rating (4.8),211,"February 20, 2018","Add to cart, Add to cart",support@uplinkly.com
QuickBooks Online or Xero Sync ," Trusted by 12,000+ merchants and accountants to automate ecommerce accounting in QuickBooks or Xero  A2X transforms your Shopify payout data into organized summaries that reconcile perfectly in QuickBooks Online (QBO) or Xero. Every Shopify transaction is accurately categorized – sales, fees, taxes, gift cards, refunds, and more – to give you better visibility into how your store is actually performing.

Join the thousands of Shopify merchants, accountants, and bookkeepers that trust A2X to save hours a month on bookkeeping, accurately track their taxes, and increase their financial visibility.   A2X transforms your Shopify payout data into organized summaries that reconcile perfectly in QuickBooks Online (QBO) or Xero. Every Shopify transaction is accurately categorized – sales, fees, taxes, gift cards, refunds, and more – to give you better visibility into how your store is actually performing.

Join the thousands of Shopify merchants, accountants, and bookkeepers that trust A2X to save hours a month on bookkeeping, accurately track their taxes, and increase their financial visibility.  more         Accurately track your Shopify sales, fees, taxes, and more in QuickBooks or Xero         Avoid overpaying taxes by assigning tax rules to every Shopify transaction type         Stay on top of COGS by matching your cost of goods sold with your Shopify sales         Access leading Shopify accountants and bookkeepers on the A2X Directory         Automate your ecommerce accounting for every channel you sell on with A2X multi    ",Rating (4.9),202,"July 12, 2019
          ·","Accounting, Financial reports, Accounting, Financial reports",support@a2xaccounting.com
PreProduct next‑gen pre‑order ," A smarter way to launch products.
Pay-later, pay-now & deposit-based preorders.  You shouldn’t have to wait until stock hits your warehouse to list your next product.

PreProduct lets brands capture pre-orders for upcoming product launches at any point in the new product cycle. Allowing you to pre-sell, gauge demand & recoup cash quicker. Pay-later & deposit-based pre-orders are only charged when you\'re ready, whether that\'s by payment link or deferred charge.   You shouldn’t have to wait until stock hits your warehouse to list your next product.

PreProduct lets brands capture pre-orders for upcoming product launches at any point in the new product cycle. Allowing you to pre-sell, gauge demand & recoup cash quicker. Pay-later & deposit-based pre-orders are only charged when you\'re ready, whether that\'s by payment link or deferred charge.  more         Communicate via custom front-end wording, customer portals and email campaign         Charge when you\'re ready pay-later, pay-now & deposit-based pre-orders supported         Deferred charges let customer\'s approve a future payment in advance         Fulfilment holds prevent premature fulfilment         Monitor/interact with pre-orders in their own system as well as Shopify orders    ",Rating (4.9),47,"March 9, 2020","Pre-orders, Purchase options - Other, Pre-orders, Purchase options - Other",hello@preproduct.io
Scarcity++ Low Stock Countdown ," Rush customers to buy with a live counting down stock counter that shows your real product inventory  Create a sense of urgency & scarcity within your customers and hurrify them to place an order by showing them a live low stock countdown that visually counts down every few seconds. Raising a sense of scarcity within your visitors can boost sales & conversions.

The inventory alert counter design is highly customizable and can appear for specific products only.

The stock countdown contains highly converting holiday presets for Easter, Mother\'s Day, St. Patrick\'s Day, Christmas, BFCM & more!   Create a sense of urgency & scarcity within your customers and hurrify them to place an order by showing them a live low stock countdown that visually counts down every few seconds. Raising a sense of scarcity within your visitors can boost sales & conversions.

The inventory alert counter design is highly customizable and can appear for specific products only.

The stock countdown contains highly converting holiday presets for Easter, Mother\'s Day, St. Patrick\'s Day, Christmas, BFCM & more!  more         Show customers the remaining inventory of a product and rush them to buy.         Create scarcity & urgency within your customers and hurrify them to order.         You can show the low stock countdown inventory alert for specific products only.         Attract visitors attention with blinking & shaking low stock label animations         Highly customizable: Fully match the low stock alert to your store\'s style    ",Rating (5),76,"June 5, 2020","Inventory tracking, Stock counter, Inventory tracking, Stock counter",support@effectify.co
Next‑Cart Store Migration ," Migrate products, customers, orders, coupons, blog posts to your online store in 3 simple steps.  Next-Cart Store Migration App allows you to migrate products, categories, customers, reviews, orders, coupons, blog posts, pages and other data from your online store to Shopify easily and accurately. Multilingual data will be migrated with products, categories, blog posts and pages. Custom fields will also be migrated according to your requirements.
We currently support migrating from 70+ eCommerce platforms to Shopify, and other custom platforms upon request.   Next-Cart Store Migration App allows you to migrate products, categories, customers, reviews, orders, coupons, blog posts, pages and other data from your online store to Shopify easily and accurately. Multilingual data will be migrated with products, categories, blog posts and pages. Custom fields will also be migrated according to your requirements.
We currently support migrating from 70+ eCommerce platforms to Shopify, and other custom platforms upon request.  more         Easily migrate data with just a few clicks         Supports all data types available on Shopify         Seamless migration from any available eCommerce platform         No downtime of your online stores    ",Rating (5),10,"September 30, 2019","Store data importers, Store data importers",contact@next-cart.com
Wholesale Gorilla ," Create a wholesale portal on your store. A simple and powerful B2B solution built by real merchants.  Wholesale Gorilla is the app we wanted when we created our Shopify store in 2013. Approved customers log in and shop your existing store, except with wholesale prices.  

Keep things simple by just setting wholesale price rules, or leverage our extensive feature set - from net terms, custom shipping, order limits, product exclusions, quantity breaks, and much more, our full suite of B2B tools has something for everyone. 

Plus, we\'re obsessed with customer service.   Its wholesale, simplified.   Wholesale Gorilla is the app we wanted when we created our Shopify store in 2013. Approved customers log in and shop your existing store, except with wholesale prices.  

Keep things simple by just setting wholesale price rules, or leverage our extensive feature set - from net terms, custom shipping, order limits, product exclusions, quantity breaks, and much more, our full suite of B2B tools has something for everyone. 

Plus, we\'re obsessed with customer service.   Its wholesale, simplified.  more         Customer service first. Running a business is hard, getting help shouldn\'t be.         Increase sales!  Quick order form, net terms, quantity breaks, and more!         Tools you\'ll love. Hide products, order limits, custom shipping rules, and more!         Seamless integration with your existing store.         Pro tier includes CSV upload, advanced product exclusions, page locks, and more!    ",Rating (4.5),173,"September 26, 2018","Wholesale pricing, Wholesale pricing",support@wholesalegorilla.net
Amai Sales Countdown Timer Bar ," Easily create and add a custom Countdown Timer to your store. Leverage FOMO and convert more!  Instantly add a customizable countdown timer to your store without costly development work. Ideal for flash sales, product launches, and event countdowns. Set up quickly and easily with a variety of options, including always active, recurring, or fixed-length timers. Countdown bars can be displayed on the header/footer and product pages, as well as be sticky, scheduled between dates, and auto-restarted.   Instantly add a customizable countdown timer to your store without costly development work. Ideal for flash sales, product launches, and event countdowns. Set up quickly and easily with a variety of options, including always active, recurring, or fixed-length timers. Countdown bars can be displayed on the header/footer and product pages, as well as be sticky, scheduled between dates, and auto-restarted.  more         Simple Setup: start/end dates, page-specific timers, toggle on/off as needed         Advanced Display Rules: repeating or independent timers, page specific timers         Fully Customizable: edit every aspect of our timer templates with ease         Email Timers: add any Timer from our app to your emails using HTML         Announcement Bars: use the app to create sitewide notifications    ",Rating (4.6),634,"November 8, 2016","Countdown timer, Promotions - Other, Countdown timer, Promotions - Other",support@amai.com
Lomio ‑ All‑In‑One A/B Testing ,"   # Use Lomio - A/B Testing to maximize your profits!

# Everything in ONE affordable app, Product A/B Testing, Content A/B Testing, and Theme A/B Testing.

Lomio has everything you need to run successful A/B Tests. A proven way to increase revenue. Lomio is an easy-to-use A/B testing solution for e-commerce brands. It allows you to make changes to your website and landing pages and create variations of the design allowing you to track conversion rate changes in real-time. You can test...   # Use Lomio - A/B Testing to maximize your profits!

# Everything in ONE affordable app, Product A/B Testing, Content A/B Testing, and Theme A/B Testing.

Lomio has everything you need to run successful A/B Tests. A proven way to increase revenue. Lomio is an easy-to-use A/B testing solution for e-commerce brands. It allows you to make changes to your website and landing pages and create variations of the design allowing you to track conversion rate changes in real-time. You can test...  more    ",Rating (5),4,"January 24, 2022","Images and media - Other, Pricing - Other, Images and media - Other, Pricing - Other",support@getlomio.com
Mobile App Builder ," Turn your store into a native iOS & Android mobile app within minutes and without writing any code.  With our drag & drop mobile app builder you can turn your Shopify store into a native iOS and Android app within minutes and without having to write a single line of code. The app is synced in real-time with your Shopify store and we support conditional tagging and metafields to ensure that the app has the same dynamic functionality as your website. You can also integrate the app with all of your favourite Shopify plugins and send unlimited push notifications for free.   With our drag & drop mobile app builder you can turn your Shopify store into a native iOS and Android app within minutes and without having to write a single line of code. The app is synced in real-time with your Shopify store and we support conditional tagging and metafields to ensure that the app has the same dynamic functionality as your website. You can also integrate the app with all of your favourite Shopify plugins and send unlimited push notifications for free.  more         Send, schedule or automate push notifications (e.g. abandoned cart).         Integrate with all of your favourite 3rd party apps.         Track user activity and make changes in real-time or schedule them for later.         Convert more with one-click checkout thanks to Apple & Google Pay.         Localise with multi-currency, language and clone store support.    ",Rating (5),28,"January 28, 2021","Mobile app builder, Mobile app builder",(+44) 02039364381
MIIUT ‑ Global Dropshipping ," Your complete dropshipping solution. Look no further.  MIIUT allows you to import & sell products from top suppliers with just a few clicks. You can even customize your product listings and prices to fit your target market.

We  make it easy to process orders and shipments, with real-time updates and alerts. And with our advanced analytics tools, you can easily monitor sales and performance.   MIIUT allows you to import & sell products from top suppliers with just a few clicks. You can even customize your product listings and prices to fit your target market.

We  make it easy to process orders and shipments, with real-time updates and alerts. And with our advanced analytics tools, you can easily monitor sales and performance.  more         Quick partnership with top suppliers         Sell products from the same suppliers as on Taobao, 1688, Ali baba         Order quality control inspections for all your shopify orders    ",Rating (4.2),134,"November 22, 2019","Dropshipping, Finding suppliers, Dropshipping, Finding suppliers",support@miiut.com
Careers Page Pro ," A job board/listing solution for your company when for hiring new staff  Our app is intuitive and intelligent, offering you one section to manage job listings and a second section where you can receive applications and take action. Once you add job listings to the app, a careers page is created where all job listings are available. They can be viewed individually and candidates can easily submit their resume and cover letter. Furthermore, you have full control over the language used in the app so you can make it available in your local language.   Our app is intuitive and intelligent, offering you one section to manage job listings and a second section where you can receive applications and take action. Once you add job listings to the app, a careers page is created where all job listings are available. They can be viewed individually and candidates can easily submit their resume and cover letter. Furthermore, you have full control over the language used in the app so you can make it available in your local language.  more         Sorting your candidates with tags such as good, average or bad         Easily share applications of candidates with your colleagues for their opinion         Beautiful design built for both desktop and mobile    ",Rating (4.7),49,"May 13, 2020","Contact form, Workflow automation, Contact form, Workflow automation",hello@smooth.ie
Intelligems Price Testing ," Easily A/B test your prices, shipping rates, and volume discounts to boost profit using real data  With Intelligems you can test A/B test your product prices, shipping rates, and bundle/volume discounts to increase AOV and margins. Our robust analytics help you understand the impacts of these tests on your conversion, revenue, and margin. 

Our team has expertise from running thousands of price elasticity tests and are happy to help. 

We also offer stand alone features like Volume Discounts where you can create discount tiers and test them to see what is working the best.   With Intelligems you can test A/B test your product prices, shipping rates, and bundle/volume discounts to increase AOV and margins. Our robust analytics help you understand the impacts of these tests on your conversion, revenue, and margin. 

Our team has expertise from running thousands of price elasticity tests and are happy to help. 

We also offer stand alone features like Volume Discounts where you can create discount tiers and test them to see what is working the best.  more         Split AB test product prices and \""compare at\"" prices across your catalog         AB Test different shipping rates and free shipping thresholds to boost profit         Customers are split across groups \""live\"" - giving you ideal data for comparison         Track AOV, Conversion, and Margin impacts in real-time dashboard         Change copy, banners, shipping bars, and other visual features across groups    ",Rating (5),38,"December 1, 2021","Competitive pricing, Pricing - Other, Competitive pricing, Pricing - Other",support@intelligems.io
