Name,Description,Rating,Reviews,Launched Date,Categories,Support Email
3Dsellers ‑ CRM & Helpdesk ," 3Dsellers Helpdesk packs all your customer support channels into one powerful software.  At 3Dsellers, we have a wide range of integrations with popular eCommerce platforms, such as Shopify, Amazon, eBay, and more. With over 10 years of experience, we’ve helped thousands of online sellers grow their businesses. Our suite of tools includes an eCommerce Helpdesk, order management system, automated feedback and product review requests, and more. With 3Dsellers, you can focus on growing your business, while we take care of the rest.   At 3Dsellers, we have a wide range of integrations with popular eCommerce platforms, such as Shopify, Amazon, eBay, and more. With over 10 years of experience, we’ve helped thousands of online sellers grow their businesses. Our suite of tools includes an eCommerce Helpdesk, order management system, automated feedback and product review requests, and more. With 3Dsellers, you can focus on growing your business, while we take care of the rest.  more         Centralized Helpdesk - Manage all your eCommerce customer support in one place.         Email Templates - Respond faster with message templates.         Auto Responder - Automate your workflow with auto responder.         Auto Messages - Helps you stay in touch with your customers automatically.         Automated Feedback Reminders and Alerts - to help you ensure great reviews.    ",Rating (5),1,"November 23, 2020","Phone support, Phone support",+1 415 230 0304
Headband Multi Top Banner Bar ," All in one top bar app. Free shipping, automatic discount, email form, countdown, multiple banners.  No need to install multiple apps for Free Shipping Bar, Automatic Discount, Coupon, Email, Announcements, or Countdown.  Headband includes all these banners in one app, so you can manage all your banners in one place, and have them work seamlessly together.

* Multiple banners can show at once.
* No changes are made to your theme
* No code necessary
* Easily customize to match your store\'s language and look & feel   No need to install multiple apps for Free Shipping Bar, Automatic Discount, Coupon, Email, Announcements, or Countdown.  Headband includes all these banners in one app, so you can manage all your banners in one place, and have them work seamlessly together.

* Multiple banners can show at once.
* No changes are made to your theme
* No code necessary
* Easily customize to match your store\'s language and look & feel  more         Free shipping progress - shoppers will spend more and convert sooner.         Countdown, discount banner, email popup, and linkable announcement for any need.         No code necessary. Easily customized look and feel to match your store.    ",Rating (4.9),5,"February 4, 2020","Banners, Discounts, Banners, Discounts",help@headbandbanners.com
Handprint:Grow with the planet ," Regenerate the planet with every sale while increasing your bottom line  Transform your brand into a regenerative powerhouse that your customers will love with just a few clicks. Show them the positive impact of their purchase during checkout in diverse categories, from coral restoration to plastic removal and mangrove reforestation. As customers are now buying from regenerative businesses more than ever, you will grow your clientele all while becoming a business that actively contributes to a healthier and more beautiful planet.   Transform your brand into a regenerative powerhouse that your customers will love with just a few clicks. Show them the positive impact of their purchase during checkout in diverse categories, from coral restoration to plastic removal and mangrove reforestation. As customers are now buying from regenerative businesses more than ever, you will grow your clientele all while becoming a business that actively contributes to a healthier and more beautiful planet.  more         Automate positive impact while increasing conversion rate and customer loyalty         Monitor real-time, end-to-end impact metrics within your personalized dashboard         Support the type of cause that best aligns with your values         Show customers how much positive impact you’ve created with our impact badge         Show your brand’s impact projects using on-the-ground content & visualizations    ",Rating (4.9),19,"February 26, 2021","Donations, Donations",support@handprint.tech
Help Ukraine Widget ,"   #Put the Help Ukraine widget on your store and help stop the cruel war against Ukraine. Then, your customers and visitors will know how to help stop Russian Aggression!

This widget is linked with trusted official sources to donate and get factual information about the WAR.

On February 24, Russia started a WAR against Ukraine, against democracy and European values.

We should stop it immediately; everyone on the planet should know it and fight against it. For this reason, we\'ve created Help...   #Put the Help Ukraine widget on your store and help stop the cruel war against Ukraine. Then, your customers and visitors will know how to help stop Russian Aggression!

This widget is linked with trusted official sources to donate and get factual information about the WAR.

On February 24, Russia started a WAR against Ukraine, against democracy and European values.

We should stop it immediately; everyone on the planet should know it and fight against it. For this reason, we\'ve created Help...  more    ",Rating (5),1,"April 20, 2022","Banners, Banners",helpukraine@jiffsy.co
Insert code Header & Footer ,"   This application is very simple to use. You just need to turn it on and paste the code you want to your Shopify page. And that’s it. This allows editing the storefront by including some changes through coding. It is open-source software. 

It comes to be the perfect app for those with some coding skills. Do you have Javascript coding knowledge? Although it looks basic, with the application, you can easily tweak your site. Other than that, you can also insert a wide range of plugins. 

Even...   This application is very simple to use. You just need to turn it on and paste the code you want to your Shopify page. And that’s it. This allows editing the storefront by including some changes through coding. It is open-source software. 

It comes to be the perfect app for those with some coding skills. Do you have Javascript coding knowledge? Although it looks basic, with the application, you can easily tweak your site. Other than that, you can also insert a wide range of plugins. 

Even...  more    ",Rating (1),3,"November 14, 2019","Content manager, Store data - Other, Content manager, Store data - Other",support@jumboapps.com
Address Edit Helper ," The app allows customer to update shipping address on their own, without need to contact support  Address Edit Helper app allows customer to easily update order shipping address on their own without having to contact customer support and wait for hours for reply.

Customer sometimes might have moved to another place, or type in wrong address by mistake, this app makes it easy for customers to update shipping address from the order status page and the account page, so that the parcel will arrive at the up to date address.   Address Edit Helper app allows customer to easily update order shipping address on their own without having to contact customer support and wait for hours for reply.

Customer sometimes might have moved to another place, or type in wrong address by mistake, this app makes it easy for customers to update shipping address from the order status page and the account page, so that the parcel will arrive at the up to date address.  more         Let customer update order shipping address on their own         Set time limit, eg: customer can only update address within 2 days of order         Disallow shipping address amendment on certain product / orders with tag    ",Rating (5),1,"September 27, 2022","Order editing, Managing orders - Other, Order editing, Managing orders - Other",axel@editaddress.app
IgnitePOST: Handwritten Cards ," Surprise and delight your customers with IgnitePOST handwritten cards and notes sent automatically.  Mail personalized handwritten notes and cards to customers. IgnitePOST handwritten cards help Shopify and e-commerce brands break through digital noise to surprise and delight their customers. Your customers will love receiving a branded, handwritten card in their mailbox. IgnitePOST handwritten notes have a 99% open rate and a 20X response rate compared to other marketing and loyalty channels.

Leave lasting impressions and create deep connections with your customers using IgnitePOST.   Mail personalized handwritten notes and cards to customers. IgnitePOST handwritten cards help Shopify and e-commerce brands break through digital noise to surprise and delight their customers. Your customers will love receiving a branded, handwritten card in their mailbox. IgnitePOST handwritten notes have a 99% open rate and a 20X response rate compared to other marketing and loyalty channels.

Leave lasting impressions and create deep connections with your customers using IgnitePOST.  more         Written by specially designed robots with real pen and ink and sent by USPS mail         Change the game, build more trust and strengthen the bonds with your customers         Ask for reviews, thank your shoppers, extend LTV, and win back abandoned carts         Integrate with your existing marketing tools in a few minutes without developers         Handwritten notes have insane ROI - over 99% open rate and beat E-mails by 20X    ",Rating (5),12,"February 15, 2019","Offline marketing, Promotions - Other, Offline marketing, Promotions - Other",support@ignitepost.com
MyAlice: Helpdesk & WhatsApp ," Send WhatsApp campaigns and automate order-related notifications. Unify all support conversations.  No more switching tabs to respond to WhatsApp, Live Chat, Facebook Messenger, Instagram, Line, Telegram, and Viber. Centralize every order, every conversation, even social comments, and DMs, all in one customer conversation view. Convert more shoppers, and retain them longer, with MyAlice — the sales-focused customer service platform for growing eCommerce merchants. Easily migrate from Gorgias, Zendesk, Freshdesk, Reamaze, Tidio, Intercom, Crisp, Live Chat, Wati, DelightChat, and SuperLemon.   No more switching tabs to respond to WhatsApp, Live Chat, Facebook Messenger, Instagram, Line, Telegram, and Viber. Centralize every order, every conversation, even social comments, and DMs, all in one customer conversation view. Convert more shoppers, and retain them longer, with MyAlice — the sales-focused customer service platform for growing eCommerce merchants. Easily migrate from Gorgias, Zendesk, Freshdesk, Reamaze, Tidio, Intercom, Crisp, Live Chat, Wati, DelightChat, and SuperLemon.  more         Allow customers to discover your business using live chat or social chat widgets         All agents can work together to respond to your clients from 1 WhatsApp number         View, edit, and cancel Shopify orders without leaving the MyAlice customer view         Use WhatsApp to recover abandoned carts, automate checkout reminders, and more         Create WhatsApp audience & send campaigns. Start with 1000 free conversations/mo    ",Rating (4.9),7,"November 18, 2021
          ·","Chat, Operations - Other, Chat, Operations - Other",+6584068880
Hello24: WhatsApp Shop+Chatbot ," List & market your products on WhatsApp, deploy WhatsApp chatbots & boost your sales!  With Hello24\'s WhatsApp Shop and Chatbot, you can list all your products from your Shopify Store & market them on WhatsApp. You can now do sales, marketing & customer support on WhatsApp using our app!

Key benefits: Rapidly grow your revenue by listing products from Shopify on WhatsApp. Achieve the industry best ROI on your marketing spends by sharing personalized product catalogs to your customer groups! Reduce customer support cost by automation using our AI chatbots   With Hello24\'s WhatsApp Shop and Chatbot, you can list all your products from your Shopify Store & market them on WhatsApp. You can now do sales, marketing & customer support on WhatsApp using our app!

Key benefits: Rapidly grow your revenue by listing products from Shopify on WhatsApp. Achieve the industry best ROI on your marketing spends by sharing personalized product catalogs to your customer groups! Reduce customer support cost by automation using our AI chatbots  more         List product catalog on WhatsApp         Auto-sync product inventory, images, description & other product info.         Share product catalogs to millions of customers instantly         Automate most of your customer queries using our AI chatbot         Smartly recover abandoned carts with instant discounts    ",Rating (5),2,"January 4, 2023","Chat, Upselling and cross-selling, Chat, Upselling and cross-selling",support@hello24.in
Halloween ," Bring the Halloween spirit to your store with decorations and music, for a scary, yet fun atmosphere  Scare your customers (not away) a little with the Halloween app for Shopify.
The main pages of your store will show an amazing Halloween decoration and pumpkins and bats falling through the screen. Optionally, scary music and sounds will also be played in the background.
The animations are integrated into your store without interfering with its navigation and functionality. It compliments every background or colour scheme.
Thanks to its responsive design, it runs smoothly on mobile and tablets.   Scare your customers (not away) a little with the Halloween app for Shopify.
The main pages of your store will show an amazing Halloween decoration and pumpkins and bats falling through the screen. Optionally, scary music and sounds will also be played in the background.
The animations are integrated into your store without interfering with its navigation and functionality. It compliments every background or colour scheme.
Thanks to its responsive design, it runs smoothly on mobile and tablets.  more         Two different themes to choose: pumpkins and bats         Show effects in all public pages or only at home page         Option to display the effects on mobile browsers         Enable or disable a button to play background music         Show or hide top and bottom decoration    ",Rating (4.9),29,"May 12, 2015","Seasonal design, Seasonal design",app-support+halloween@thesupportheroes.com
Desku ‑ Helpdesk & Live Chat ," Unify Customer Communication | Retain More Customers | Market, Sell & Support OS For Merchants  Convert and Retain more shopper with Desku - the revenue-focused customer experience platform for fast-growing ecommerce merchants. Desku helps ecommerce merchants accelerate growth and maximize their revenues by unifying all support conversations, orders, social comments and DMs into one customer ticket view. Easily promote your products through whatsapp and and email campaigns within same dashboard. Market, Sell & Support from single dashboard.   Convert and Retain more shopper with Desku - the revenue-focused customer experience platform for fast-growing ecommerce merchants. Desku helps ecommerce merchants accelerate growth and maximize their revenues by unifying all support conversations, orders, social comments and DMs into one customer ticket view. Easily promote your products through whatsapp and and email campaigns within same dashboard. Market, Sell & Support from single dashboard.  more         Market, Sell & Support with the All In One Messaging Platform         Automate Customer Support with Whatsapp & Facebook Chatbots         View, edit, and cancel Shopify orders without leaving the Desku customer view         The ability to prioritize response over email, chat and social media comments         Full customer context before answering, with order and conversation history    ",Rating (5),3,"April 20, 2022","Support ticket management, Social proof - Other, Support ticket management, Social proof - Other",info@desku.io
Reactflow Recordings & Heatmap ," Reactflow optimizes your store conversion rate, detect bugs and root cause of bounces.  Reactflow helps analyzing your visitor behaviors and highlighting their pain points, helping you to gain faster ROI.
When a visitor comes to your website, they will be bombarded with a lot of buttons, menus, and links to click, and you want them to click on purchase links more than all other links.   Reactflow helps analyzing your visitor behaviors and highlighting their pain points, helping you to gain faster ROI.
When a visitor comes to your website, they will be bombarded with a lot of buttons, menus, and links to click, and you want them to click on purchase links more than all other links.  more         Just like a Camera in physical shop, you can record and playback your visitors         Click, mouseover and scrolls Heatmaps of your pages.         Conduct surveys, polls, ask for your visitors opinions.    ",Rating (3.8),2,"March 11, 2020","Customer analytics, Sales analytics, Customer analytics, Sales analytics",‭+60 19 694 5313‬
The Seller Helper ," Our app allows you to choose products, manage inventory, orders & tracking via a single dashboard.  With our app you can select any product(s) from our large catalog and send them individually or in bulk to your store. Our app will keep your products updated so you aren\'t selling out of stock products.

You will also be able to place your orders in one click or fully automate ordering/fulfillment. As soon as tracking is available our app will send tracking back to your Shopify store which allows for quick communications with your customers and giving you more time to grown your business.   With our app you can select any product(s) from our large catalog and send them individually or in bulk to your store. Our app will keep your products updated so you aren\'t selling out of stock products.

You will also be able to place your orders in one click or fully automate ordering/fulfillment. As soon as tracking is available our app will send tracking back to your Shopify store which allows for quick communications with your customers and giving you more time to grown your business.  more         Automated Inventory         Automated Ordering         Automated Tracking         Huge Product Catalog to Choose From    ",Rating (1),1,"October 13, 2022","Dropshipping, Dropshipping",800-584-3040
Help Center HQ ‑ TCC ," Help Center HQ allows you to add a help center or FAQ page to your store in just a few minutes.  HelpHQ allows users to get answers immediately from your own Frequently Asked Questions/Q&A page. An effective help center can answer massive amounts of questions before the customer has a chance to email you. HelpHQ will gather valuable satisfaction data on your help center articles. You will learn which question can be answered better, what\'s dissatisfying customers, what´s working, and so much more.   HelpHQ allows users to get answers immediately from your own Frequently Asked Questions/Q&A page. An effective help center can answer massive amounts of questions before the customer has a chance to email you. HelpHQ will gather valuable satisfaction data on your help center articles. You will learn which question can be answered better, what\'s dissatisfying customers, what´s working, and so much more.  more         Insta-search: It will find answers instantly as the user types their question.         Powerful editor: it makes writing help articles and a faq page a breeze.         Customizable: to build a FAQ page that fits in with your store and brand.         Seamless integration: manage your help center from the same familiar dashboard.         Customer Feedback: collect user customer feedback through simple emojis.    ",Rating (5),28,"April 30, 2019","Page builder, Support - Other, Page builder, Support - Other",hello@apphq.co
Scribeless | Handwritten notes ," Send handwritten direct mail to customers and prospects. Make your business feel more personal.  Increase customer retention by 31% with automated handwritten marketing by sending handwritten mail post-purchase. Handwritten mail almost always gets opened, so you can stand out from the digital noise your customers drown in daily.

- Follow up on orders to stay front of mind with top customers.
- Get another chance with abandoned carts.
- Increase customer retention and product reviews.
- Enrich your customer experience with personalized QR codes.   Increase customer retention by 31% with automated handwritten marketing by sending handwritten mail post-purchase. Handwritten mail almost always gets opened, so you can stand out from the digital noise your customers drown in daily.

- Follow up on orders to stay front of mind with top customers.
- Get another chance with abandoned carts.
- Increase customer retention and product reviews.
- Enrich your customer experience with personalized QR codes.  more         Automatic direct mail, sent from our facilities in US, UK & CA.         Luxury materials, with real stamps applied to the envelope or postcard.         AI powered \""handwriting\"" - 99% of people can\'t tell the difference.    ",Rating (4.3),10,"November 20, 2019","Abandoned cart, Offline marketing, Abandoned cart, Offline marketing",+1 (972) 591-8522
Return Helper: Return Centre ," Automate Returns through a multi-language Branded Portal and 13+ Local Return Centers  # Why Return Helper?

Return Helper is an end-to-end return management solution that optimizes retailers’ return process and aftermarket activities.Focusing on the needs of cross border e-commerce merchants, Return Helper currently connects to 15+ overseas warehouses and 30+ international shipping partners.

# Improve customer loyalty with a branded return page
# Shipping automation and auto-generated return label
# Local warehouses in over 13 countries
# Bulk recall your international returns   # Why Return Helper?

Return Helper is an end-to-end return management solution that optimizes retailers’ return process and aftermarket activities.Focusing on the needs of cross border e-commerce merchants, Return Helper currently connects to 15+ overseas warehouses and 30+ international shipping partners.

# Improve customer loyalty with a branded return page
# Shipping automation and auto-generated return label
# Local warehouses in over 13 countries
# Bulk recall your international returns  more         Support multi-language         Customizable returns page         Customize return reasons         Automate Label Generation         Return notification    ",Rating (5),1,"July 14, 2022","Returns and exchanges, Returns and exchanges",shippinglabel@returnhelper.com
Pre‑Order Helper ," Enable your customers to pre-order your products.  With Pre-Order Helper, invite your customers to easily place preorders & schedule delivery dates on your store. Customize your product & collection pages and track the total items sold in a centralized in-app dashboard. 

Pre-Order Helper also allows you to design your pre-order button according to your brand guidelines.

Don’t miss out on the opportunity to sell out-of-stock or not-available items. Provide an option to your customers to pre-order them and increase your product sales & revenue.   With Pre-Order Helper, invite your customers to easily place preorders & schedule delivery dates on your store. Customize your product & collection pages and track the total items sold in a centralized in-app dashboard. 

Pre-Order Helper also allows you to design your pre-order button according to your brand guidelines.

Don’t miss out on the opportunity to sell out-of-stock or not-available items. Provide an option to your customers to pre-order them and increase your product sales & revenue.  more         Allow your customers to preorder out-of-stock products and their variants.         A centralized analytics dashboard to see ROI and $$$ generated from the app.         Simple design widget to customize preorder buttons, text & style for branding.         Import/Export to enable preorders for multiple specific products / SKUs.         Schedule and ship at a later date.    ",Rating (4.3),9,"June 11, 2019","Pre-orders, Pre-orders",themes@wholesalehelper.io
Preorder and Wholesale • Handy ," Manage Pre-orders and Wholesales in one powerful app  Your useful case with different tools for managing your Web Store. We\'ve carefully put together some essential tools for your store so that instead of multiple apps, you can only install one.   Your useful case with different tools for managing your Web Store. We\'ve carefully put together some essential tools for your store so that instead of multiple apps, you can only install one.  more         Powerful Pre-order management tool: Partial payments, Schedule, Translations         Wholesale tool allows you to set different prices for different customers         Bar tool: Describe the delivery terms, worn your customers about COVID-19 rules    ",Rating (5),1,"November 2, 2021","Pre-orders, Wholesale pricing, Pre-orders, Wholesale pricing",h@ndy.app
